<?xml version="1.0" encoding="UTF-8"?>
<!DOCTYPE XMI SYSTEM "org/cocons/uml/ccl/ccl10.dtd">
<XMI xmi.version="1.0">
  <XMI.header>
    <XMI.documentation>
      <XMI.exporter>Novosoft UML Library</XMI.exporter>
      <XMI.exporterVersion>0.4.19</XMI.exporterVersion>
    </XMI.documentation>
    <XMI.metamodel xmi.name="UML" xmi.version="1.3"/>
  </XMI.header>
  <XMI.content>
    <Model_Management.Model xmi.id="xmi.1">
      <Foundation.Core.ModelElement.isSpecification xmi.value="false"/>
      <Foundation.Core.GeneralizableElement.isRoot xmi.value="false"/>
      <Foundation.Core.GeneralizableElement.isLeaf xmi.value="false"/>
      <Foundation.Core.GeneralizableElement.isAbstract xmi.value="false"/>
      <Foundation.Core.Namespace.ownedElement>
        <Foundation.Extension_Mechanisms.TaggedValue xmi.id="xmi.2">
          <Foundation.Extension_Mechanisms.TaggedValue.dataValue>FirstValue</Foundation.Extension_Mechanisms.TaggedValue.dataValue>
          <Foundation.Extension_Mechanisms.TaggedValue.dataValue>SecondValue</Foundation.Extension_Mechanisms.TaggedValue.dataValue>
        </Foundation.Extension_Mechanisms.TaggedValue>
        <Foundation.Core.Class xmi.id="xmi.3">
          <Foundation.Core.ModelElement.name>myModelElement</Foundation.Core.ModelElement.name>
          <Foundation.Core.ModelElement.isSpecification xmi.value="false"/>
          <Foundation.Core.GeneralizableElement.isRoot xmi.value="false"/>
          <Foundation.Core.GeneralizableElement.isLeaf xmi.value="false"/>
          <Foundation.Core.GeneralizableElement.isAbstract xmi.value="false"/>
          <Foundation.Core.Class.isActive xmi.value="false"/>
          <Foundation.Core.ModelElement.namespace>
            <Foundation.Core.Namespace xmi.idref="xmi.1"/>
          </Foundation.Core.ModelElement.namespace>
        </Foundation.Core.Class>
      </Foundation.Core.Namespace.ownedElement>
    </Model_Management.Model>
  </XMI.content>
</XMI>